{
  "$schema": "https://json-schema.org/draft/2020-12/schema",
  "$id": "https://fabric.passioncode.ai/agent-contract/0.1.0/schemas/support-quality-daily.schema.json",
  "title": "support-quality-daily/1 (DEC-0095): one support channel's quality for one closed UTC day, as an event's data.value",
  "description": "Counts and rates only: no person's words, no ids, no judge notes. A metric not computed is null and is named in notMeasured, never 0 (FAC-SEM-126). Fits DEC-0070's data.value: two levels, at most 32 members each; a reader recognises it by data.value.kind.",
  "type": "object",
  "required": [
    "kind",
    "day",
    "channel",
    "rubricVersion",
    "judgeModel",
    "notMeasured",
    "nobodyDropped",
    "quality",
    "stability",
    "autonomy",
    "checks"
  ],
  "properties": {
    "kind": {
      "const": "support-quality-daily/1"
    },
    "day": {
      "type": "string",
      "format": "date",
      "description": "The closed UTC day measured."
    },
    "channel": {
      "enum": [
        "chat",
        "mail",
        "reviews",
        "community"
      ]
    },
    "rubricVersion": {
      "type": [
        "string",
        "null"
      ],
      "maxLength": 32,
      "pattern": "^[A-Za-z0-9._-]{1,32}$"
    },
    "judgeModel": {
      "type": [
        "string",
        "null"
      ],
      "maxLength": 160,
      "pattern": "^[a-z0-9][a-z0-9._-]*/[A-Za-z0-9._:-]+$",
      "description": "The judge's <vendor>/<model>, another vendor than the drafter."
    },
    "notMeasured": {
      "type": "array",
      "maxItems": 32,
      "uniqueItems": true,
      "items": {
        "type": "string",
        "pattern": "^[a-z][A-Za-z]{0,63}(\\.[a-z][A-Za-z_]{0,63})?$"
      },
      "description": "Each metric not computed, as family.metric, or checks when no check was judged."
    },
    "nobodyDropped": {
      "type": "object",
      "additionalProperties": false,
      "required": [
        "turns",
        "replyCoverage",
        "firstReplyP50Ms",
        "firstReplyP90Ms",
        "repeatAskRate",
        "agentRepeats",
        "answeredLater"
      ],
      "properties": {
        "turns": {
          "$ref": "#/$defs/count"
        },
        "replyCoverage": {
          "$ref": "#/$defs/rate"
        },
        "firstReplyP50Ms": {
          "$ref": "#/$defs/count"
        },
        "firstReplyP90Ms": {
          "$ref": "#/$defs/count"
        },
        "repeatAskRate": {
          "$ref": "#/$defs/rate"
        },
        "agentRepeats": {
          "$ref": "#/$defs/count"
        },
        "answeredLater": {
          "$ref": "#/$defs/count"
        }
      }
    },
    "quality": {
      "type": "object",
      "additionalProperties": false,
      "required": [
        "sampled",
        "helpedYes",
        "helpedPartly",
        "helpedNo"
      ],
      "properties": {
        "sampled": {
          "$ref": "#/$defs/count"
        },
        "helpedYes": {
          "$ref": "#/$defs/count"
        },
        "helpedPartly": {
          "$ref": "#/$defs/count"
        },
        "helpedNo": {
          "$ref": "#/$defs/count"
        }
      }
    },
    "checks": {
      "type": [
        "object",
        "null"
      ],
      "maxProperties": 16,
      "propertyNames": {
        "pattern": "^[a-z][a-z_]{0,31}$"
      },
      "additionalProperties": {
        "type": "number",
        "minimum": 0,
        "maximum": 1
      },
      "description": "Each rubric check's pass rate among its non-NA verdicts (language, addressed, policy_safe, routing, actionable, continuity in rubric v1); a check with no verdict that day is left out; null when nothing was judged. At the top level so data.value stays two levels deep (DEC-0070). Never empty: with no check judged it is null.",
      "minProperties": 1
    },
    "stability": {
      "type": "object",
      "additionalProperties": false,
      "required": [
        "turnErrors",
        "modelCallFailures",
        "recoveredByFallback",
        "processErrors",
        "restarts",
        "knowledgeAgeHours"
      ],
      "properties": {
        "turnErrors": {
          "$ref": "#/$defs/count"
        },
        "modelCallFailures": {
          "$ref": "#/$defs/count"
        },
        "recoveredByFallback": {
          "$ref": "#/$defs/count"
        },
        "processErrors": {
          "$ref": "#/$defs/count"
        },
        "restarts": {
          "$ref": "#/$defs/count"
        },
        "knowledgeAgeHours": {
          "$ref": "#/$defs/count"
        }
      }
    },
    "autonomy": {
      "type": "object",
      "additionalProperties": false,
      "required": [
        "resolvedWithoutPerson",
        "toPersonPolicy",
        "toPersonInability",
        "queueOldestMinutes",
        "queueSlaMinutes"
      ],
      "properties": {
        "resolvedWithoutPerson": {
          "$ref": "#/$defs/count"
        },
        "toPersonPolicy": {
          "$ref": "#/$defs/count"
        },
        "toPersonInability": {
          "$ref": "#/$defs/count"
        },
        "queueOldestMinutes": {
          "$ref": "#/$defs/count"
        },
        "queueSlaMinutes": {
          "$ref": "#/$defs/count"
        }
      }
    },
    "calibration": {
      "type": "object",
      "additionalProperties": false,
      "required": [
        "week",
        "labelled",
        "helped"
      ],
      "description": "Optional (DEC-0144): how well the judge agreed with people on the latest ISO week a person labelled answers, starting no later than day, carried on every day it still holds for (a reader never carries it forward). Absent means no calibration. week is that ISO week, labelled the answers a person labelled, helped the share of those whose helped verdict the judge matched (null when helped was not labelled, named calibration.helped in notMeasured). Each check's agreement is calibrationChecks, at the top level so data.value stays two levels deep (DEC-0070). It is of the day's judge and rubric, and a week no later than day. A producer carries it once every reader of its feed it knows of has adopted DEC-0144: the schema is closed, so a reader validating against an older copy refuses that day's value.",
      "properties": {
        "week": {
          "type": "string",
          "pattern": "^[0-9]{4}-W(0[1-9]|[1-4][0-9]|5[0-3])$",
          "description": "The ISO 8601 week of the labelling, YYYY-Www."
        },
        "labelled": {
          "type": "integer",
          "minimum": 1,
          "description": "The answers a person labelled that week."
        },
        "helped": {
          "$ref": "#/$defs/rate"
        }
      }
    },
    "calibrationChecks": {
      "type": "object",
      "minProperties": 1,
      "maxProperties": 16,
      "propertyNames": {
        "pattern": "^[a-z][a-z_]{0,31}$"
      },
      "additionalProperties": {
        "type": "number",
        "minimum": 0,
        "maximum": 1
      },
      "description": "Optional (DEC-0144), only beside calibration: each rubric check's share of the labelled verdicts the judge matched, named as in checks; a check a person did not label is left out, and with none labelled the member is absent, never empty."
    }
  },
  "additionalProperties": false,
  "$defs": {
    "count": {
      "type": [
        "integer",
        "null"
      ],
      "minimum": 0
    },
    "rate": {
      "type": [
        "number",
        "null"
      ],
      "minimum": 0,
      "maximum": 1
    }
  }
}
